{
  "schemaVersion": 1,
  "name": "which",
  "description": "Locate a program in the user's PATH",
  "args": {
    "name": "names",
    "isVariadic": true,
    "generators": {
      "script": [
        "bash",
        "-c",
        "for i in $(echo $PATH | tr \":\" \"\n\"); do find $i -maxdepth 1 -perm -111 -type f; done"
      ],
      "postProcess": {
        "handler": "manual.src_which.spec.args.generators.postprocess",
        "version": 1
      }
    },
    "filterStrategy": "fuzzy",
    "suggestCurrentToken": true
  },
  "options": [
    {
      "name": "-s",
      "description": "No output, return 0 if all the executables are found, 1 if not"
    },
    {
      "name": "-a",
      "description": "List all instances of executables found, instead of just the first"
    }
  ]
}
