{
  "schemaVersion": 1,
  "name": "nr",
  "description": "Use the right package manager - run",
  "options": [
    {
      "name": [
        "-h",
        "--help"
      ],
      "description": "Output usage information"
    }
  ],
  "args": {
    "name": "script",
    "description": "The script to run",
    "filterStrategy": "fuzzy"
  },
  "additionalSuggestions": [
    {
      "name": "-",
      "insertValue": "-\n",
      "description": "Run the last command",
      "type": "shortcut"
    }
  ]
}
