{
  "schemaVersion": 1,
  "name": "cot",
  "icon": "https://coteditor.com/favicon@2x.png",
  "description": "Command-line utility for CotEditor",
  "args": {
    "template": "filepaths"
  },
  "options": [
    {
      "description": "Show help message and exit",
      "name": [
        "-h",
        "--help"
      ]
    },
    {
      "description": "Show program's version number and exit",
      "name": [
        "-v",
        "--version"
      ]
    },
    {
      "description": "Wait for opened file to be closed",
      "name": [
        "-w",
        "--wait"
      ]
    },
    {
      "description": "Do not bring the application to the foreground",
      "name": [
        "-g",
        "--background"
      ]
    },
    {
      "description": "Create a new blank document",
      "name": [
        "-n",
        "--new"
      ]
    },
    {
      "description": "Jump to specific line in opened document",
      "name": [
        "-l",
        "--line"
      ],
      "args": {
        "name": "line"
      }
    },
    {
      "description": "Jump to specific column in opened document",
      "name": [
        "-c",
        "--column"
      ],
      "args": {
        "name": "column"
      }
    }
  ]
}
